{
  "$schema": "https://json-schema.org/draft/2020-12/schema",
  "$id": "meeting-minutes.schema.json",
  "title": "会议纪要模板数据",
  "type": "object",
  "additionalProperties": false,
  "required": ["meeting", "attendees", "topics", "decisions", "actionItems"],
  "properties": {
    "meeting": {
      "type": "object",
      "additionalProperties": true,
      "required": ["title", "time", "location", "host", "recorder"],
      "properties": {
        "title": { "type": "string", "minLength": 1 },
        "time": { "type": "string", "minLength": 1 },
        "location": { "type": "string", "minLength": 1 },
        "host": { "type": "string", "minLength": 1 },
        "recorder": { "type": "string", "minLength": 1 }
      }
    },
    "attendees": {
      "type": "array",
      "minItems": 1,
      "items": {
        "type": "object",
        "additionalProperties": true,
        "required": ["name"],
        "properties": {
          "name": { "type": "string", "minLength": 1 },
          "role": { "type": "string" }
        }
      }
    },
    "topics": {
      "type": "array",
      "minItems": 1,
      "items": {
        "type": "object",
        "additionalProperties": true,
        "required": ["title", "summary"],
        "properties": {
          "title": { "type": "string", "minLength": 1 },
          "summary": { "type": "string", "minLength": 1 }
        }
      }
    },
    "decisions": {
      "type": "array",
      "minItems": 1,
      "items": {
        "type": "object",
        "additionalProperties": true,
        "required": ["item", "owner"],
        "properties": {
          "item": { "type": "string", "minLength": 1 },
          "owner": { "type": "string", "minLength": 1 }
        }
      }
    },
    "actionItems": {
      "type": "array",
      "minItems": 1,
      "items": {
        "type": "object",
        "additionalProperties": true,
        "required": ["task", "owner", "dueDate"],
        "properties": {
          "task": { "type": "string", "minLength": 1 },
          "owner": { "type": "string", "minLength": 1 },
          "dueDate": { "type": "string", "minLength": 1 },
          "status": { "type": "string" }
        }
      }
    }
  }
}
