{
  "meeting": {
    "title": "项目推进周例会",
    "time": "2026年7月1日 10:00-11:30",
    "location": "第一会议室",
    "host": "张三",
    "recorder": "李四"
  },
  "attendees": [
    {
      "name": "张三",
      "role": "项目负责人"
    },
    {
      "name": "李四",
      "role": "实施负责人"
    },
    {
      "name": "王五",
      "role": "技术负责人"
    }
  ],
  "topics": [
    {
      "title": "项目整体进度",
      "summary": "项目总体按计划推进，当前重点是完成需求确认和模板渲染能力验证。"
    },
    {
      "title": "近期风险与问题",
      "summary": "需关注模板样式一致性、跨平台运行环境和后续模板动态安装流程。"
    }
  ],
  "decisions": [
    {
      "item": "优先完成通用方案和会议纪要两个内置模板的端到端验证。",
      "owner": "项目组"
    },
    {
      "item": "新增模板必须先通过 schema、样例渲染和 docx 结构校验后再注册。",
      "owner": "技术组"
    }
  ],
  "actionItems": [
    {
      "task": "整理会议纪要模板字段说明和样例数据。",
      "owner": "李四",
      "dueDate": "2026年7月3日",
      "status": "进行中"
    },
    {
      "task": "完成模板注册表列表和解析能力验证。",
      "owner": "王五",
      "dueDate": "2026年7月5日",
      "status": "未开始"
    }
  ]
}
